{
  "$schema": "https://json-schema.org/draft/2020-12/schema",
  "$id": "https://monkey-skills/investing-toolkit/data-cn/memo-fetch.json",
  "title": "data-cn memo-fetch pack",
  "description": "Equity memo data bundle for a single CN/HK ticker. Tier 2 ONLY — CN primary-source individual-stock disclosure (cninfo / HKEXnews) is deferred from v2.0.0 scope. yfinance is the current floor for financials. _provenance.tier is integer 2 (CN-specific; data-us uses string 'A').",
  "type": "object",
  "required": ["pack", "ticker", "country", "_provenance", "tier_note", "yfinance_info", "yfinance_history", "yfinance_financials_annual", "yfinance_financials_quarterly"],
  "additionalProperties": true,
  "properties": {
    "pack": { "const": "memo-fetch" },
    "ticker": { "type": "string" },
    "country": { "const": "CN" },
    "_provenance": {
      "type": "object",
      "description": "Tier-status block. CN memo-fetch is locked at Tier 2 because primary-source individual-stock disclosure (cninfo / HKEXnews) is not integrated.",
      "required": ["tier", "tier_reason", "primary_source_status", "primary_source_candidates"],
      "additionalProperties": true,
      "properties": {
        "tier": {
          "type": "integer",
          "const": 2,
          "description": "Tier 2 = aggregator/scraper floor. Always integer in CN (data-us uses string 'A')."
        },
        "tier_reason": { "type": "string" },
        "primary_source_status": {
          "type": "string",
          "enum": ["deferred", "integrated", "partial"],
          "description": "v2.0.0: always 'deferred' for CN. Reserved enum values for forward-compat."
        },
        "primary_source_candidates": {
          "type": "array",
          "description": "Named primary-source repositories evaluated but not integrated.",
          "items": { "type": "string" },
          "examples": [["cninfo (CSRC)", "HKEXnews"]]
        }
      }
    },
    "tier_note": {
      "type": "string",
      "description": "Human-readable echo of the tier-status reason. Surface in memo footer."
    },
    "yfinance_info": { "$ref": "schema-snapshot.json#/$defs/yfinanceInfo" },
    "yfinance_history": { "$ref": "schema-snapshot.json#/$defs/yfinanceHistory" },
    "yfinance_financials_annual": { "$ref": "#/$defs/yfinanceFinancials" },
    "yfinance_financials_quarterly": { "$ref": "#/$defs/yfinanceFinancials" }
  },
  "$defs": {
    "yfinanceFinancials": {
      "type": "object",
      "description": "yfinance financials (income / balance-sheet / cash-flow). period=annual|quarterly. WARNING: Tier 2 — never use for verdict-grade memos without cross-check vs cninfo / HKEXnews / company filings.",
      "additionalProperties": true,
      "properties": {
        "ticker": { "type": "string" },
        "period": { "type": "string", "enum": ["annual", "quarterly"] },
        "fetched_at": { "type": "string", "format": "date-time" },
        "_cache": { "type": "string", "enum": ["hit", "miss"] },
        "latest_period": { "type": ["string", "null"] },
        "key_metrics": { "type": "object", "additionalProperties": true },
        "income_statement": { "type": "object", "additionalProperties": true },
        "balance_sheet": { "type": "object", "additionalProperties": true },
        "cash_flow": { "type": "object", "additionalProperties": true },
        "_warning": { "type": ["string", "null"] }
      }
    }
  }
}
