{
  "pack": "memo-fetch",
  "ticker": "600519.SS",
  "country": "CN",
  "_provenance": {
    "tier": 2,
    "tier_reason": "CN primary-source individual-stock disclosure not in v2.0.0 scope",
    "primary_source_status": "deferred",
    "primary_source_candidates": [
      "cninfo (CSRC)",
      "HKEXnews"
    ]
  },
  "tier_note": "Tier 2 only — CN primary-source individual-stock disclosure (cninfo / HKEXnews) not in v2.0.0 scope. yfinance financials is the current floor.",
  "yfinance_info": {
    "ticker": "600519.SS",
    "fetched_at": "2026-05-01T15:09:26Z",
    "_cache": "hit",
    "_warning": "yfinance is an unofficial scraper. DO NOT use for financial statements (income statement, balance sheet, cash flow). Use SEC EDGAR for financials.",
    "symbol": "600519.SS",
    "shortName": "KWEICHOW MOUTAI",
    "longName": "Kweichow Moutai Co., Ltd.",
    "sector": "Consumer Defensive",
    "industry": "Beverages - Wineries & Distilleries",
    "country": "China",
    "currency": "CNY",
    "exchange": "SHH",
    "regularMarketPrice": 1384.79,
    "regularMarketPreviousClose": 1401.17,
    "marketCap": 1734131318784,
    "enterpriseValue": 1692696051712,
    "trailingPE": 20.965784,
    "forwardPE": 18.4381,
    "priceToBook": 6.396584,
    "trailingEps": 66.05,
    "forwardEps": 75.10481,
    "dividendYield": 3.73,
    "payoutRatio": 0.78180003,
    "fiftyTwoWeekHigh": 1645.0,
    "fiftyTwoWeekLow": 1322.01,
    "fiftyDayAverage": 1435.28,
    "twoHundredDayAverage": 1440.4822,
    "sharesOutstanding": 1252270215,
    "totalRevenue": 172146393088,
    "grossMargins": 0.90514,
    "operatingMargins": 0.68024004,
    "profitMargins": 0.48049,
    "returnOnEquity": 0.31198,
    "returnOnAssets": 0.22059,
    "totalDebt": 242421552,
    "totalCash": 50586689536,
    "beta": 0.525,
    "_provenance": {
      "source": "yfinance (unofficial Yahoo Finance scraper)",
      "source_authority": "Yahoo Finance (unofficial, not endorsed)",
      "data_type": "unofficial_scraper",
      "update_cycle": "near-real-time (15 min delay)",
      "typical_lag": "15 minutes (price) / 1 day (fundamentals)",
      "fetched_at": "2026-05-01T15:09:26Z",
      "reference_period": null,
      "staleness_days": null
    }
  },
  "yfinance_history": {
    "ticker": "600519.SS",
    "period": "2y",
    "interval": "1d",
    "fetched_at": "2026-05-01T15:09:40Z",
    "_cache": "miss",
    "data": [
      {
        "date": "2024-04-30",
        "open": 1585.9881,
        "high": 1609.122,
        "low": 1585.9788,
        "close": 1585.9788,
        "volume": 3075989
      },
      {
        "date": "2024-05-06",
        "open": 1612.9265,
        "high": 1641.7904,
        "low": 1606.4431,
        "close": 1637.3254,
        "volume": 5990949
      },
      {
        "date": "2024-05-07",
        "open": 1642.5251,
        "high": 1653.6967,
        "low": 1634.051,
        "close": 1646.4412,
        "volume": 2492452
      },
      {
        "date": "2024-05-08",
        "open": 1646.1527,
        "high": 1646.4132,
        "low": 1633.1115,
        "close": 1640.832,
        "volume": 1476909
      },
      {
        "date": "2024-05-09",
        "open": 1635.279,
        "high": 1641.7717,
        "low": 1627.8374,
        "close": 1633.4186,
        "volume": 2238734
      },
      {
        "date": "2024-05-10",
        "open": 1638.1625,
        "high": 1644.4693,
        "low": 1612.945,
        "close": 1617.5867,
        "volume": 2620661
      },
      {
        "date": "2024-05-13",
        "open": 1611.1126,
        "high": 1611.7079,
        "low": 1582.4626,
        "close": 1586.9089,
        "volume": 3766212
      },
      {
        "date": "2024-05-14",
        "open": 1586.8995,
        "high": 1593.6713,
        "low": 1581.337,
        "close": 1583.1694,
        "volume": 2127417
      },
      {
        "date": "2024-05-15",
        "open": 1583.7276,
        "high": 1588.7693,
        "low": 1580.0162,
        "close": 1581.3278,
        "volume": 1573876
      },
      {
        "date": "2024-05-16",
        "open": 1585.9788,
        "high": 1590.5181,
        "low": 1572.0259,
        "close": 1585.5137,
        "volume": 2967954
      },
      {
        "date": "2024-05-17",
        "open": 1581.3369,
        "high": 1596.7502,
        "low": 1581.3276,
        "close": 1595.2805,
        "volume": 2892388
      },
      {
        "date": "2024-05-20",
        "open": 1598.0619,
        "high": 1612.0148,
        "low": 1588.8716,
        "close": 1589.6995,
        "volume": 3142572
      },
      {
        "date": "2024-05-21",
        "open": 1588.7693,
        "high": 1590.3786,
        "low": 1579.6163,
        "close": 1585.9788,
        "volume": 1629339
      },
      {
        "date": "2024-05-22",
        "open": 1584.1184,
        "high": 1590.5925,
        "low": 1572.9561,
        "close": 1579.1976,
        "volume": 2028568
      },
      {
        "date": "2024-05-23",
        "open": 1581.3277,
        "high": 1587.2624,
        "low": 1572.1002,
        "close": 1573.8955,
        "volume": 1888497
      },
      {
        "date": "2024-05-24",
        "open": 1574.8164,
        "high": 1576.6768,
        "low": 1559.9333,
        "close": 1560.0077,
        "volume": 2021663
      },
      {
        "date": "2024-05-27",
        "open": 1560.8635,
        "high": 1569.6538,
        "low": 1551.5709,
        "close": 1553.5336,
        "volume": 2509791
      },
      {
        "date": "2024-05-28",
        "open": 1553.7941,
        "high": 1558.2311,
        "low": 1546.9106,
        "close": 1548.4362,
        "volume": 2352087
      },
      {
        "date": "2024-05-29",
        "open": 1549.7012,
        "high": 1562.7239,
        "low": 1548.771,
        "close": 1557.1427,
        "volume": 1965128
      },
      {
        "date": "2024-05-30",
        "open": 1558.073,
        "high": 1558.4264,
        "low": 1533.8879,
        "close": 1533.8879,
        "volume": 3220792
      },
      {
        "date": "2024-05-31",
        "open": 1535.2832,
        "high": 1547.3757,
        "low": 1533.3762,
        "close": 1533.3762,
        "volume": 2185665
      },
      {
        "date": "2024-06-03",
        "open": 1534.8181,
        "high": 1535.6739,
        "low": 1520.9675,
        "close": 1524.9487,
        "volume": 3026105
      },
      {
        "date": "2024-06-04",
        "open": 1525.9813,
        "high": 1540.3993,
        "low": 1522.3071,
        "close": 1537.7947,
        "volume": 2084108
      },
      {
        "date": "2024-06-05",
        "open": 1536.6784,
        "high": 1542.8921,
        "low": 1528.3346,
        "close": 1529.2368,
        "volume": 1905557
      },
      {
        "date": "2024-06-06",
        "open": 1528.9207,
        "high": 1536.6692,
        "low": 1521.7117,
        "close": 1525.3395,
        "volume": 2561005
      },
      {
        "date": "2024-06-07",
        "open": 1531.2183,
        "high": 1531.2649,
        "low": 1505.9915,
        "close": 1506.1497,
        "volume": 3352455
      },
      {
        "date": "2024-06-11",
        "open": 1491.0897,
        "high": 1492.9594,
        "low": 1457.612,
        "close": 1459.4724,
        "volume": 7024676
      },
      {
        "date": "2024-06-12",
        "open": 1460.4027,
        "high": 1479.0065,
        "low": 1460.4027,
        "close": 1461.9655,
        "volume": 3317050
      },
      {
        "date": "2024-06-13",
        "open": 1466.7,
        "high": 1466.8116,
        "low": 1444.7288,
        "close": 1446.459,
        "volume": 3618597
      },
      {
        "date": "2024-06-14",
        "open": 1446.4498,
        "high": 1454.7843,
        "low": 1414.3209,
        "close": 1446.4498,
        "volume": 5951416
      },
      {
        "date": "2024-06-17",
        "open": 1425.3251,
        "high": 1440.6546,
        "low": 1405.5305,
        "close": 1433.8921,
        "volume": 4831816
      },
      {
        "date": "2024-06-18",
        "open": 1424.0229,
        "high": 1446.0219,
        "low": 1410.8049,
        "close": 1415.2883,
        "volume": 4125825
      },
      {
        "date": "2024-06-19",
        "open": 1422.2821,
        "high": 1427.9884,
        "low": 1407.1952,
        "close": 1425.14,
        "volume": 4126153
      },
      {
        "date": "2024-06-20",
        "open": 1424.1905,
        "high": 1439.3913,
        "low": 1422.2916,
        "close": 1424.2854,
        "volume": 2471068
      },
      {
        "date": "2024-06-21",
        "open": 1424.6652,
        "high": 1428.9188,
        "low": 1395.9155,
        "close": 1396.6561,
        "volume": 4331997
      },
      {
        "date": "2024-06-24",
        "open": 1351.082,
        "high": 1413.7369,
        "low": 1342.5464,
        "close": 1401.9257,
        "volume": 6383993
      },
      {
        "date": "2024-06-25",
        "open": 1402.3528,
        "high": 1427.0293,
        "low": 1402.3528,
        "close": 1411.5151,
        "volume": 4209795
      },
      {
        "date": "2024-06-26",
        "open": 1405.2012,
        "high": 1425.2063,
        "low": 1403.1124,
        "close": 1413.9552,
        "volume": 2956977
      },
      {
        "date": "2024-06-27",
        "open": 1416.5948,
        "high": 1418.4652,
        "low": 1393.8078,
        "close": 1415.1611,
        "volume": 3282178
      },
      {
        "date": "2024-06-28",
        "open": 1405.2012,
        "high": 1418.9589,
        "low": 1390.0098,
        "close": 1393.2285,
        "volume": 3858202
      },
      {
        "date": "2024-07-01",
        "open": 1394.6432,
        "high": 1398.5455,
        "low": 1355.8293,
        "close": 1367.5836,
        "volume": 3216138
      },
      {
        "date": "2024-07-02",
        "open": 1360.5767,
        "high": 1422.2916,
        "low": 1360.5767,
        "close": 1415.3605,
        "volume": 5185298
      },